{
  "schema_version": "1.0",
  "run_id": "123e4567-e89b-42d3-a456-426614174000",
  "manifest_id": "126b2cb058cc7702127f7f95a89e3fee4a1a7d835361d6f7d04be36a31ccda34",
  "generated_at": "2026-07-26T20:00:00.200Z",
  "verdict": "pass",
  "exit_code": 0,
  "counts": {
    "scenarios": 1,
    "attempts": 1,
    "observations": 1,
    "assertions": 1
  },
  "failure_refs": [],
  "artifacts": {
    "manifest": "run-manifest.json",
    "deliveries": "deliveries.jsonl",
    "observations": "observations.jsonl",
    "assertions": "assertions.jsonl",
    "junit": "junit.xml",
    "html": "results.html"
  }
}
